{
  "$version": "1.0",
  "$schema": "./registry_entities.schema.json",
  "updated_at": "2025-01-01",
  "description": "Registry of government entities for the CAG audit report repository. IDs are permanently stable — never change even if entity is renamed or restructured. active=false + archived=true for dissolved entities. v1.0: NITI Aayog corrected to level:advisory_body (was statutory_body — factual error, NITI Aayog is created by Cabinet Resolution not an Act). advisory_body added to level_values. GOI-MIN-PETROLEUM added. function_vocabulary extracted to taxonomy_entity_functions.json — this file retains a reference copy until migration is complete.",
  "id_convention": {
    "description": "ID prefix encodes jurisdiction and entity type. IDs must match pattern ^[A-Z0-9][A-Z0-9\\-]+[A-Z0-9]$",
    "prefixes": [
      { "prefix": "GOI-MIN", "meaning": "Central Government Ministry" },
      { "prefix": "GOI-DEPT", "meaning": "Central Government Department (under a Ministry)" },
      { "prefix": "GOI-OFF", "meaning": "Central Government Attached or Subordinate Office" },
      { "prefix": "GOI-PSU", "meaning": "Central Public Sector Undertaking" },
      { "prefix": "GOI-AUTH", "meaning": "Central Government Authority or Board" },
      { "prefix": "CONST", "meaning": "Constitutional Body (independent of executive)" },
      { "prefix": "STAT", "meaning": "Statutory Body (created by Act of Parliament)" },
      { "prefix": "ADVB", "meaning": "Advisory/Executive Body (created by Cabinet Resolution or executive order)" },
      { "prefix": "IN-{ST}-DEPT", "meaning": "State/UT Department — ST = ISO 3166-2 state code" },
      { "prefix": "IN-{ST}-PSU", "meaning": "State/UT Public Sector Undertaking" },
      { "prefix": "IN-{ST}-AUTH", "meaning": "State/UT Authority or Board" }
    ]
  },
  "level_values": [
    "ministry",
    "department",
    "attached_office",
    "subordinate_office",
    "authority",
    "board",
    "psu",
    "statutory_body",
    "constitutional_body",
    "advisory_body",
    "local_body"
  ],
  "entity_type_values": [
    "ministry",
    "department",
    "office",
    "psu",
    "authority",
    "board",
    "commission",
    "corporation",
    "statutory_body",
    "constitutional_body",
    "autonomous_body",
    "advisory_body",
    "local_body"
  ],
  "level_entity_type_mapping": {
    "description": "Canonical mapping from level to valid entity_type values. Pipeline validates this pairing on ingest.",
    "ministry": ["ministry"],
    "department": ["department"],
    "attached_office": ["office"],
    "subordinate_office": ["office"],
    "authority": ["authority", "board", "commission"],
    "board": ["board", "authority"],
    "psu": ["psu", "corporation"],
    "statutory_body": ["statutory_body", "commission", "corporation", "autonomous_body"],
    "constitutional_body": ["constitutional_body"],
    "advisory_body": ["advisory_body", "commission"],
    "local_body": ["local_body"]
  },
  "function_vocabulary_ref": "taxonomy_entity_functions.json",
  "function_vocabulary": {
    "description": "TRANSITIONAL — extract to taxonomy_entity_functions.json. Retained here for backward compatibility. When that file exceeds 50 entries, this inline copy should be removed.",
    "functions": [
      { "id": "FUNC-RURAL-DEV", "label": { "en": "Rural Development and Panchayati Raj" } },
      { "id": "FUNC-FINANCE", "label": { "en": "Finance and Revenue" } },
      { "id": "FUNC-HOME", "label": { "en": "Home and Internal Security" } },
      { "id": "FUNC-HEALTH", "label": { "en": "Health and Family Welfare" } },
      { "id": "FUNC-EDUCATION", "label": { "en": "School Education" } },
      { "id": "FUNC-HIGHER-EDU", "label": { "en": "Higher and Technical Education" } },
      { "id": "FUNC-AGRICULTURE", "label": { "en": "Agriculture and Allied Services" } },
      { "id": "FUNC-IRRIGATION", "label": { "en": "Irrigation and Water Resources" } },
      { "id": "FUNC-FORESTS", "label": { "en": "Forests and Environment" } },
      { "id": "FUNC-PWD", "label": { "en": "Public Works and Infrastructure" } },
      { "id": "FUNC-URBAN-DEV", "label": { "en": "Urban Development and Housing" } },
      { "id": "FUNC-SOCIAL-WELFARE", "label": { "en": "Social Welfare and Tribal Affairs" } },
      { "id": "FUNC-ENERGY", "label": { "en": "Energy and Power" } },
      { "id": "FUNC-TRANSPORT", "label": { "en": "Transport and Roads" } },
      { "id": "FUNC-REVENUE", "label": { "en": "Revenue and Land Records" } },
      { "id": "FUNC-TELECOM", "label": { "en": "Telecommunications and IT" } },
      { "id": "FUNC-PLANNING", "label": { "en": "Planning and Programme Implementation" } },
      { "id": "FUNC-AUDIT", "label": { "en": "Audit and Accounts" } },
      { "id": "FUNC-PETROLEUM", "label": { "en": "Petroleum, Natural Gas and Minerals" } },
      { "id": "FUNC-LABOUR", "label": { "en": "Labour Welfare and Employment" } }
    ]
  },
  "entries": [
    {
      "id": "CONST-CAG",
      "name": { "en": "Office of the Comptroller and Auditor General of India", "hi": "भारत के नियंत्रक-महालेखापरीक्षक का कार्यालय" },
      "short_name": { "en": "CAG of India", "hi": "भारत के CAG" },
      "acronym": "CAG",
      "level": "constitutional_body",
      "entity_type": "constitutional_body",
      "jurisdiction": "UNION",
      "state_ut_id": null,
      "function_ids": ["FUNC-AUDIT"],
      "parent_id": null,
      "hq": { "en": "New Delhi", "hi": "नई दिल्ली" },
      "established": "1950-01-26",
      "active": true,
      "archived": false,
      "dissolution_reason": null,
      "dissolved_on": null,
      "name_history": [],
      "predecessor_ids": [],
      "successor_ids": [],
      "notes": { "en": "Constitutional body under Article 148. Supreme audit institution of India." }
    },
    {
      "id": "GOI-MIN-FINANCE",
      "name": { "en": "Ministry of Finance", "hi": "वित्त मंत्रालय" },
      "short_name": { "en": "Finance Ministry" },
      "acronym": "MOF",
      "level": "ministry",
      "entity_type": "ministry",
      "jurisdiction": "UNION",
      "state_ut_id": null,
      "function_ids": ["FUNC-FINANCE"],
      "parent_id": null,
      "hq": { "en": "New Delhi", "hi": "नई दिल्ली" },
      "established": "1947-08-15",
      "active": true,
      "archived": false,
      "dissolution_reason": null,
      "dissolved_on": null,
      "name_history": [],
      "predecessor_ids": [],
      "successor_ids": [],
      "notes": {}
    },
    {
      "id": "GOI-DEPT-REVENUE",
      "name": { "en": "Department of Revenue", "hi": "राजस्व विभाग" },
      "short_name": { "en": "Dept of Revenue" },
      "acronym": "DoR",
      "level": "department",
      "entity_type": "department",
      "jurisdiction": "UNION",
      "state_ut_id": null,
      "function_ids": ["FUNC-REVENUE", "FUNC-FINANCE"],
      "parent_id": "GOI-MIN-FINANCE",
      "hq": { "en": "New Delhi", "hi": "नई दिल्ली" },
      "established": "1947-08-15",
      "active": true,
      "archived": false,
      "dissolution_reason": null,
      "dissolved_on": null,
      "name_history": [],
      "predecessor_ids": [],
      "successor_ids": [],
      "notes": { "en": "Administers direct and indirect taxes through CBDT and CBIC." }
    },
    {
      "id": "GOI-AUTH-CBDT",
      "name": { "en": "Central Board of Direct Taxes", "hi": "केंद्रीय प्रत्यक्ष कर बोर्ड" },
      "short_name": { "en": "CBDT" },
      "acronym": "CBDT",
      "level": "board",
      "entity_type": "board",
      "jurisdiction": "UNION",
      "state_ut_id": null,
      "function_ids": ["FUNC-FINANCE", "FUNC-REVENUE"],
      "parent_id": "GOI-DEPT-REVENUE",
      "hq": { "en": "New Delhi", "hi": "नई दिल्ली" },
      "established": "1963-01-01",
      "active": true,
      "archived": false,
      "dissolution_reason": null,
      "dissolved_on": null,
      "name_history": [],
      "predecessor_ids": [],
      "successor_ids": [],
      "notes": { "en": "Statutory body under Central Board of Revenue Act 1963. Administers income tax and other direct taxes." }
    },
    {
      "id": "GOI-AUTH-CBIC",
      "name": { "en": "Central Board of Indirect Taxes and Customs", "hi": "केंद्रीय अप्रत्यक्ष कर और सीमा शुल्क बोर्ड" },
      "short_name": { "en": "CBIC" },
      "acronym": "CBIC",
      "level": "board",
      "entity_type": "board",
      "jurisdiction": "UNION",
      "state_ut_id": null,
      "function_ids": ["FUNC-FINANCE", "FUNC-REVENUE"],
      "parent_id": "GOI-DEPT-REVENUE",
      "hq": { "en": "New Delhi", "hi": "नई दिल्ली" },
      "established": "2018-01-01",
      "active": true,
      "archived": false,
      "dissolution_reason": null,
      "dissolved_on": null,
      "name_history": [
        {
          "name": { "en": "Central Board of Excise and Customs" },
          "acronym": "CBEC",
          "valid_from": "1964-01-01",
          "valid_to": "2018-08-26"
        }
      ],
      "predecessor_ids": [],
      "successor_ids": [],
      "notes": { "en": "Renamed from CBEC to CBIC on 26 Aug 2018 following GST rollout." }
    },
    {
      "id": "GOI-MIN-RURAL-DEV",
      "name": { "en": "Ministry of Rural Development", "hi": "ग्रामीण विकास मंत्रालय" },
      "short_name": { "en": "Rural Development Ministry" },
      "acronym": "MoRD",
      "level": "ministry",
      "entity_type": "ministry",
      "jurisdiction": "UNION",
      "state_ut_id": null,
      "function_ids": ["FUNC-RURAL-DEV"],
      "parent_id": null,
      "hq": { "en": "New Delhi", "hi": "नई दिल्ली" },
      "established": "1979-01-01",
      "active": true,
      "archived": false,
      "dissolution_reason": null,
      "dissolved_on": null,
      "name_history": [],
      "predecessor_ids": [],
      "successor_ids": [],
      "notes": { "en": "Administers MGNREGS, PMGSY, PMAY-G, and other rural flagship schemes." }
    },
    {
      "id": "GOI-MIN-HEALTH",
      "name": { "en": "Ministry of Health and Family Welfare", "hi": "स्वास्थ्य और परिवार कल्याण मंत्रालय" },